id,comment_id,Comment
1226,2356,"the student has grasp how to install operating system software and the supporting software on the computer
she is also a faster learner interns of mastering the technological ideas"
1227,2357,Mourisha is a quick learner and has the urge to learn new things. She however needs more exposure to the field for more hands on work.
1228,2358,I commend you Bena for the commitment and diligence exhibited. Your positive attitude is laudable and will really take you place and make you an admirable professional. Keep it up.
1229,2359,"The student gained a holistic understanding of various types of screens and how to differentiate them.
The student learnt various practical aspects about capacitors like how to discharge them, how to differentiate the rods of a capacitor, etc."
1230,2360,I encourage Yvette to upgrade her machine so that it can handle heavy tasks.
1231,2361,I am impressed with his relentlessness to fix errors and understanding of cases where they occur.
1232,2364,Solomon participated in the networking project that was running at the Commission and I believe he picked up some invaluable skills that will benefit him in the future.
1234,2366,Emmanuel Configured Internet Banking System as instructed and he did it successful. He displayed professionalism in handling IT related issues.
1235,2367,"Does not require constant supervision.
Has had no unscheduled absences, except for documented emergencies.
Maintains good working relationships with coworkers.
Usually adjusts well to changes in the work place.
Takes messages, writes correspondence, deals with customers and coworkers with sufficient attention to detail."
1236,2368,"He learned network connection , crimping of Ethernet Cables and assigning IP Addresses to a computer and was able to share data across the devices."
1237,2369,Field Attachment tasks fully and well accomplished!
1238,2370,"Benon's attendance record for these week was exceedingly proper regardless of the network connection challenges.
He has continued to maintain a good working relationship with team members she was assigned to.
He is so inquisitive, asks to learn and he has been so attentive during all the trainings."
1239,2371,"Hilda has successfully completed this week's tasks. Because of curfew, I encourage her to plan her movements a bit early."
1240,2372,Progressed in the systems development tasks at hand.
1245,2378,"Umar's attendance record for these week was exceedingly proper regardless of the network connection challenges.
He has continued to maintain a good working relationship with team members she was assigned to.
He is so inquisitive, asks to learn and he has been so attentive during all the trainings."
1246,2381,"Despite the internet expenses, he managed to lead the sprint and be in sync with the rest of the team."
1247,2382,She acquired the practical skills needed to set up a Small Office Home Network (SOHO) and also setup a  cyber cafe of 6 computers.
1248,2385,Collins met expectations for the week.
1249,2386,"Joan's attendance record for these week was exceedingly proper regardless of the network connection challenges.
Joan did not require constant supervision
She has continued to maintain a good working relationship with team members she was assigned to."
1250,2387,She is hardworking and has good leadership skills.
1251,2388,he is open to learning new concepts in a given programming language even if he has no ideas about them and he follows what he is told to do
1252,2389,"Timothy completed the eCommerce system and integrated it with the website and the payment system as well. The client was invited to come in and a presentation of the minimum viable website (prototype) was presented to her. The client was happy with the prototype but as expected introduced new features which were not part of the original design. I tasked Timothy to discuss the additions with the client and he was able to have a fruitful discussion with the client which resulted into two new additional features namely adding submission form, and adding an image to the video section."
1254,2392,I encourage Patricia to make use of Stratcom wifi incase she needs to access any resource online.
1258,2396,Thank you Viola for the diligence and commitment. I hope you will now be able to get better network coverage since the lockdown has been lifted.
1259,2398,I commend you Mariam for the positive attitude exhibited so far. I am sure you will have the new tasks before the week commences.
1262,2401,It's because of damaged BNC cables that Harnest wasn't able to set up a surveillance system this week. This task will be completed next week.
1266,2406,Timothy completes tasks with ease. He is a promising Networking guru.
1267,2409,Thanks Alex for the persistence and commitment. I hope you will be a better professional at the end of the assignments.
1268,2411,He wasn't familiar with some networking equipment but we managed to show him practically how to operate them (intermediary devices ) and he's now good.
1269,2412,I encourage Sarah to get used to walking because it's good for her health.
1270,2413,"Does not require constant supervision.
Has had no unscheduled absences, except for documented emergencies.
Maintains good working relationships with coworkers.
Usually adjusts well to changes in the work place.
Takes messages, writes correspondence, deals with customers and coworkers with sufficient attention to detail."
1271,2414,"He takes accountability on everything done
He is dependable"
1273,2416,Limited knowledge with ERP systems but a good learning speed to catch up.
1274,2418,Sam managed to complete this week's tasks without any challenge.
1275,2419,Thanks Priscilla for the persistence and commitment. Keep it up.
1284,2429,"Despite the power outage, good job with the other fixes taken up, indicates you have learnt the react basics."
1285,2430,The Mock ups guided us in creating a minimal viable product for digital customer profiling platform in preparation for  demonstration to potential customers
1290,2437,Leticia successfully completed this week's tasks without any challenge. She is a promising Networking professional.
1291,2438,He managed to set up a wireless LAN and he can now configure any type of access point. He can also build and configure access lists on layer 3 devices to restrict access to network  resources.
1293,2440,This work is well done.
1294,2441,"Despite afew challenges, Joshua managed to complete this week's tasks."
1295,2443,"Andrew's attendance record for these week was exceedingly proper regardless of the network connection challenges.
He has continued to maintain a good working relationship with team members she was assigned to.
He is so inquisitive, asks to learn and he has been so attentive during all the trainings."
1296,2444,Task well done
1297,2446,Keep learning
1301,2453,Completed the assignment and showed good understanding of the concepts
1303,2458,We are impressed by Isaac Sempiira input on the virtual internship with BCG
1304,2459,Please share the interface in next week's presentation
1308,2464,I encourage Daniel to contact the Lead Developer so that he can show him how to debug errors in code.
1311,2467,Thank you Andrew for the diligence exhibited thus far. Next week we shall revert to the payments plugin and go through the process of publishing it in the WooCommerce marketplace.
1312,2470,"He successfully completed this week's main tasks, that is, configuring VLANs on layer 2 devices and fixing PCs"
1316,2474,"Mr. Joshua this week has worked on a vehicle parking management system in PHP laravel. The project is under development with a good progressive projection. This project has helped the trainee to exercise his programming and coding skills in PHP. 
There is a distinctive growth in the working ethics of the trainee and efficiency growth is observed."
1317,2475,I encourage Jacob to plan his movement a bit early to avoid issues with security personnel.
1318,2476,I encourage Resty to plan her movements abit early and avoid being inconvenienced by security during curfew time.
1319,2477,New tasks for the handling of GPS data for quality analysis of the datasets. We have had meetings to discuss the possible theoretical approaches for detection of anomalous data points. Diana has managed to add new features to the data using reverse geo-coding and this will enable the creation of more refined filters for the data.
1320,2478,Analysis for one of the new datasets has been completed and the results have been presented to a satisfactory level. We have also had discussions about how to utilize some of the data attributes to impute the missing values in the dataset where applicable and I look forward to the implementation of the proposed solutions.
1321,2479,"The database created contained a list of items which were sold , this went on well"
1322,2480,Bazaale was in for the question and answer session.
1323,2481,Steven completes all practical tasks with ease. He is a promising Networking professional.
1325,2484,Indicated progress on tasks assigned to the intern in week 5 reviewed and completion acknowledged.
1328,2487,"Acram was so interactive in this session, I believe we answered most of the questions that he had in mind."
1329,2488,"She has demonstrated a good communication with her supervisors, Though does not ask questions. It needed me the supervisor to follow up on her and this delayed her tasks to be completed in time
Phiona's attendance record for these week was exceedingly proper regardless of the network connection challenges.
She has continued to maintain a good working relationship with team members she was assigned to."
1330,2489,"She has demonstrated a good communication with her supervisors, Though does not ask questions. It needed me the supervisor to follow up on her and this delayed her tasks to be completed in time
Phiona's attendance record for these week was exceedingly proper regardless of the network connection challenges.
She has continued to maintain a good working relationship with team members she was assigned to."
1331,2491,"She has demonstrated a good communication with her supervisors, Though does not ask questions. It needed me the supervisor to follow up on her and this delayed her tasks to be completed in time
Phiona's attendance record for these week was exceedingly proper regardless of the network connection challenges.
She has continued to maintain a good working relationship with team members she was assigned to."
1332,2492,Thank you Shivan for the persistence and commitment. Keep it up.
1333,2493,"He takes accountability on everything done
He is dependable"
1334,2495,Please share the notebook on Google Colab and I see what the real challenge is.
1335,2497,Internet was too poor this week
1336,2498,Was able to finish Graphics work as they advanced in Networking too.
1337,2499,Hopefully Geofrey got answers to all his questions in this session.
1338,2500,This was done
1339,2502,Intern Is progressing well
1340,2503,His laptop was the challenge since softwares to be used were increasing and his computer couldn't handle them fully.
1341,2504,"It was quite an interesting week with a lot of work to be done but we pulled it off and Mr Abudi was of much great and appreciated help. 
He researched and listed all tools that we can use to spot for our social media platforms especially the website, theablestate.com."
1343,2507,Jacintah is working on the end of internship challenge. I encourage her to contact the Lead Developer incase of any challenge and to make use of internet to read more about different programming languages.
1344,2508,"Musumba's attendance record for these week was exceedingly proper regardless of the network connection challenges.
He has continued to maintain a good working relationship with team members she was assigned to.
He is so inquisitive, asks to learn and he has been so attentive during all the trainings."
1345,2509,Indicated progress on tasks assigned to the intern in week 5 reviewed and completion acknowledged.
1346,2512,I'm sorry Racheal about the personal challenges that have affected your output. I commend you for not giving up on the team and the assignment amidst all these challenges. I hope the situation gets better.
1347,2513,She improvises where its needed to help another colleague and its helpful to work with her.
1348,2514,she is very active in consulting and always looking for away forward depending on the problem we are solving.
1349,2515,"she is a team player, interactive  and  professional in whatever she does."
1350,2516,Lubega Nabunje exhibit good relationship with partners and deliver project well.
1351,2517,"Does not require constant supervision.
Has had no unscheduled absences, except for documented emergencies.
Maintains good working relationships with coworkers.
Usually adjusts well to changes in the work place.
Takes messages, writes correspondence, deals with customers and coworkers with sufficient attention to detail."
1352,2518,Richard has acquired the basic knowledge of writing USSD applications.
1353,2519,Satisfactory progress
1354,2520,The Unet model was updated with 2 more variations with minor changes in the architecture to improve the model IOU accuracy. I am also very impressed with the organization of the code on GitHub which is very clear and modular and easy to learn.
1355,2521,"Arrangements for data facilitation are being made. Please contact Ms. Dorothy.
Looking forward to seeing results from the Figma task."
1356,2522,Mulema has acquired some basic knowledge of doing Mobile money payments and Card. He can now integrate this in a web application.
1358,2526,Requirements gathering and documentation was done well. He understood the requirements well and proceeds to database design. As well usage of version control tools
1359,2528,"Good progress made by Micheal:
- Micheal accomplished his tasks to expectations as awarded in the week's sprint. 
- proving to be a good resource with design work  -  coming in handy to make changes to already designed work. There is room for him to develop further his design abilities --maybe through undertaking some short courses in graphic design to improve his appreciation of visual appeal in addition to functionality."
1360,2530,Thanks Ryan for the commitment to the project and diligence to see it through. Keep it up.
1361,2531,Pius has created views which will enable the access and advanced preprocessing of the base data before it is transmitted to through the end points. The basic views enable access of all the data which is a good start. I hope to see the advanced implementation when we have a review with othe4r members of the team that are handling the data analysis.
1362,2532,Matia has got knowledge about SSH and remote server configuration for web system deployment. He has also acquired adequate knowledge about PHP and its principles.
1363,2533,Thank you Sharifa for retracing your steps even after faltering. It is this positive attitude that will take you places. Please keep it up.
1364,2534,"Asingwire has been an interactive person in this session, she would take a step to explain to others where they go wrong."
1365,2535,"The User Interface is a basic one but good for the start, and hope you can build onto that to do something better next time. But I'm pleased with the work done so far on the project. please keep going."
1366,2536,"Bwimi has obtained knowledge in making payment integrations, Using PHP, MySQL, HTML, and JS, she can write a simple payment integration for Mobile money and Card with support from Flutterwave."
1367,2537,"The recommended changes have been made and the report has been completed for the project. I am satisfied with the documentation of the EDA, experimentation and results as reflected in the report. The GitHub repository has also been updated to reflect the recommended changes in the experiment"
1368,2539,"Kenneth started to work on his final report for the internship, he probably missed our class on payment integration."
1369,2540,He was Working on his final project report
1370,2541,Semata was present in the last class where we interacted and solved the questions that everyone had
1371,2542,Progressive week since he met the week's deliverable targets.
1372,2543,A fast learner and a good time manager
1373,2544,Guloba has acquired good knowledge on about PHP and git
1374,2545,"Guloba has acquired knowledge about SQL, he can write simple commands like SELECT, and INSERT INTO. he can also write simple scripts with PHP and MySQLi"
1375,2546,"Using PHP and MySQLi, Guloba can write simple USSD applications"
1376,2547,Guloba has started obtaining simple knowledge about payment integration
1377,2548,"Kirya has acquired knowledge on making payment integrations with Mobile money and Card. He can now use this knowledge to write a cashless applications in the real world. Keep practicing, Kirya."
1378,2550,Thanks Jedidiah for the commitment. The communication problems in your team have greatly affected your output. They really need to be worked on.
1379,2553,Thank you Trevor for the diligence exhibited thus far. Keep it up.
1380,2555,Keep learning
1381,2557,Thank you Walter for the commitment to the project and diligence to see it through up to this point. Keep it up.
1382,2558,"Despite a few challenges, Rebecca managed to start internship at Stratcom and she is doing well. Because of distance, I encourage her to start her journey abit early so that she can be at Stratcom in time for training."
1383,2559,Rebecca successfully completed this week's main task of configuring VLANs on layer 2 devices and DHCP on layer 3 devices.
1384,2560,At first she had abit trouble with basic device configuration. But She has perfected all commands needed to operate the cisco IOS.
1385,2561,"After completing this week's main tasks, Rebecca can now fix a PC. She can also set up a wireless network and accommodate wireless users on a wired network."
1386,2567,"Your challenges are noted, but as team leader, you were involved in the documentation of the user stories and the drafting of the solutions design document. It is at that stage that we ought to have addressed any ambiguity. I have not altered your requirements. I have let you run the project and am always ready to clarify any bit of the requirements that is not clear. I encourage you to work more closely with your colleague to get this product delivered."
1387,2568,all task were completed on time
1388,2569,You are able to pick up new tools easily and your general productivity is good. I would love to see you being better at explaining your work by teaching someone else. Overall it was a good week.
1389,2572,This task was executed well with minimal help which shows me that he is learning and getting comfortable with handling servers.
1390,2573,The ability to document everything that you set up on a server is very important because in case the person that set it up is not able to work on something then any other member of the group can handle whatever needs to be done.  We have very good progress with this and some good documentation has been made.
1391,2574,Solomon needs to invest some more time in working with computer hardware but otherwise he has a clear grasp of the basics of hardware maintenance.
1392,2575,"He advanced in the tasks at hand, with excellent team work."
1393,2576,Pamella managed to start internship at Stratcom and she is doing well.
1394,2577,"Noeline started her internship at Stratcom, and she is doing well."
1395,2578,Elysmus has completed this week's tasks without any challenge. He is doing well.
1396,2583,"Despite a few challenges, Aida managed to complete this week's main tasks. I still encourage her to upgrade her machine for better performance."
1397,2584,Hellen started her internship at Stratcom and she is doing well. She also completed this week's main tasks without any challenge.
1398,2585,Louisa is almost done with the end of internship challenge.
1399,2587,Patricia managed to start internship and she is doing well.
1401,2589,The student has been enable to successfully master how to configure DHCP SERVER and configure LAN
1402,2591,Nansamba Nuluyati has good etiquette and good manners.
1403,2592,"Kayiwa checked the design document before submission for discussion. The output reflects the overall team level of understanding of the assignment, so my contribution was appreciated. Though he experienced connectivity setbacks my assessment is that the team underestimated the work involved at this stage of a system build from scratch. I expect the them to catch up as the business requirements get clearer with progress."
1404,2594,"Benadette, I'm impressed by your diligence. Please keep it up."
1405,2595,The program was operating well
1406,2596,"Umar's attendance record for these week was exceedingly proper regardless of the network connection challenges.
He has continued to maintain a good working relationship with team members she was assigned to.
He is so inquisitive, asks to learn and he has been so attentive during all the trainings."
1407,2598,"Joan's attendance record for these week was exceedingly proper regardless of the network connection challenges.
Joan did not require constant supervision
She has continued to maintain a good working relationship with team members she was assigned to."
1408,2599,Technical challenges were a hindrance to him this week.
1409,2600,Focus was on networking this week.
1410,2601,Presented as much of the design document as had been prepared. Appreciated the contribution towards the logical views and omission in the processes. Only 60% of the week's assignment was completed. This was due to underestimation of the work involved in the beginning of a development /system building project. I expect the team to catch up as the business requirements get clearer as we progress.
1411,2602,Resty should get used to errors because they are part of coding. She also has to present a solution for the coding challenge before we sign her off.
1412,2603,Collins met expectations for the week.
1413,2604,I was impressed by the deployment plan; very detailed with summarised tables. But deploying is another thing so I look forward to how you will fare.
1414,2605,Sam has perfected all commands needed to configure a cisco router and switch.
1415,2607,"Despite power issues, Stom is almost done with the challenge. Before we sign him off, he has to present the end of internship challenge (a Jobconnect App) that will link job seekers to recruiters."
1416,2608,This was done
1417,2609,"Great sprint demo, good job leading the sprint and taking team advise."
1418,2610,I'm sorry to learn about the electricity outages Viola. I encourage you to persist and accomplish the tasks at hand.
1419,2612,Rhoda managed to start her internship at Stratcom and so far she is doing well. She switched from coding to networking practical sessions.
1420,2613,"Before we sign her off, Mary is supposed to present end of internship coding challenge. She is doing well so far."
1421,2614,Margret managed to start her internship at Stratcom and she is doing well.
1422,2615,Awaiting the plan for the website
1423,2617,Sarah successfully completed this week's tasks. She's a promising networking professional.
1425,2619,self driven and can work independently
1426,2620,"Before we sign him off, Alex should present a solution for the end of internship challenge."
1427,2621,"Progress has been made with analyzing the geodata to generate more attributes that will be used  to impute missing values on one of the datasets.
Sharon has also worked using GPS coordinates on another dataset to compute the distance between data points."
1428,2622,"Before we sign him off, Davis should present a solution for the end of internship challenge."
1429,2623,Solomon has started internship and he is doing well. I encourage him to contact the Lead Trainer in case of any challenge
1430,2624,"Despite transport challenge, Gilbert managed to start internship at Stratcom and he is doing well."
1431,2625,"Aaron managed to start internship at Stratcom and he's doing well. He also completed this week's main tasks. That is, cable termination,  dismantling and assembling PCs, and performing basic configurations on layer 2 & 3 devices."
1432,2626,"Resty doesn't need internet to do practical sessions in Networking. That aside, she has completed this week's tasks."
1433,2627,Sandra should learn to first do requirements analysis before developing any app.
1434,2628,"He successfully completed this week's tasks, that is, configuring access control lists on layer 3 devices to filter network traffic. He has also perfected all commands needed to operate the cisco IOS."
1436,2630,Heather started her internship at Stratcom and she's doing well. She also managed to complete this week's tasks without any challenge.
1437,2632,"Before we sign him off, Joshua should present a solution for the coding challenge."
1438,2633,"Before we sign him off, Collins is supposed to present a solution for the internship coding challenge."
1439,2634,"Before we sign her off, Mariam should present a solution for the end of internship challenge."
1440,2635,"Before we sign him off, Raymond has to present the end of internship challenge (Coding a JobConnect App from scratch). I also encourage him to get used to debugging errors since debugging is inseparable with coding."
1441,2636,"Despite  a few challenges, Sarah has started internship at Stratcom. She can now terminate and test network cables in addition to performing basic configurations on intermediary devices (routers and switches)."
1442,2637,I encourage Martha to get used to errors because they are part of coding.
1443,2638,Active participation in the workshop. Good job again with these fixes.
1444,2639,"Before we sign him off, Edwin should present a solution for the coding challenge. He should also upgrade his machine for better performance."
