id,comment_id,Comment
3437,5710,She has successfully completed the geo-spatial data analysis tasks which required one to use reverse geo-coding to get information about the districts as a way of feature engineering.
3438,5711,She finished the last Koans for Java she now has a better understanding of the principles of the language
3439,5712,worked on a cpanel
3440,5713,Very good and total participation in the practical training.
3441,5714,"Managed to set up both LANs and WLANs, shared resources, and remotely accessed computers connected to the Network."
3442,5716,"He is very punctual.
Good at communication and is eager to learn"
3443,5717,"Mariam is committed and dedicated to producing  information to time and
quality. She is a strong communicator who actively contributed ideas for
improvement and was always willing to take on additional challenges."
3444,5718,this is a good experience for him to know and understand networks and he is catching up well. very good work
3445,5719,Introduced to hardware maintenance
3447,5722,"The student was dependable and always willing to go above and beyond expectations.
I observed she had a passion in coding & system analysis. 
She drew the process diagrams with some mistakes but was very open to learning; she implemented the corrections given."
3448,5723,We started off well but trailed off towards the end of the week. We ths will be completed at the start of the week so we can tackle the coming week's tasks
3449,5724,"First week Mr Sinani and other interns reported and were inducted, showed around the Parliament premises and ICT data centers, both in the Main Building and Development House. He also took part in the verification exercise of new ICT equipment procured by Parliament after delivery by the supplier for conformity with what were specified in the procurement documents. Additionally he handled user support of troubleshooting network breakdown, password resetting and Wi-Fi in Development House and some few cases in Kingdom Kampala where we also have offices for staff and MPs. so far so good."
3453,5729,tasks well accomplished
3454,5730,Elijah managed to design a CI/CD pipeline that demonstrated how companies get features quickly and efficiently delivered to the end user.
3455,5731,"Despite transport challenge, Maria has managed to complete this week's tasks."
3456,5733,"Sonia has been quick at adopting to the environment and ICT Department systems.
Still a good time manager, and consults whenever assigned duties. She is handy whenever needed."
3457,5734,The student has diligently researched and completed the assigments given to him
3458,5736,"LAN and WLAN set up and administration skills were demonstrated
Time management and Group setting working"
3459,5737,Hellen learning to work without supervision and deliver on defined timelines. This is an attribute that will come in handy as you navigate your daily tasks now and after school.
3460,5742,"I encourage Givious to practice multitasking. By doing so, he will be able to handle the semester load and internship training with ease."
3461,5743,Dickens has perfected Cisco IOS configurations commands. He can now configure layer 2 and 3 devices with ease.
3462,5746,"I can access the hosted system from https://www.pepsimt.com/login, though told her to work on the responsiveness on the mobile devices."
3463,5750,Looked for ways to learn better and put to use the knowledge he was learning. Good Job Terry.
3464,5751,"Successfully interacted with the server and managed to deploy applications.
Did code reviews, and testing.
Fast learning curve for PHP, MYSQL"
3465,5752,"Conrad is a good student, always trying out all ways of tackling an existing problem."
3466,5753,Some mishaps like power cuts hindered your velocity but overall great job keeping up whenever you had the opportunity.
3467,5754,Off to a slow start but your willingness to adapt to remote this week is very commendable.
3468,5756,"Boris has successfully completed the first week of internship . 
we are going to equip him with hands on skills and practical competence for next 6 weeks , for practice purpose i encourage him to be co-operative and ready to learn"
3469,5757,Technical works and repairs have highlighted the week and the progress is good. He is doing his work well and in time.
3470,5758,"Student did the assignment, termination of cables and some troubleshooting assignments well."
3471,5759,The main concentration this week was IT/Networking.
3472,5760,Kyagaba is very committed and managed to implement the user interfaces for a data manipulation system. Looking forward to seeing how he can integrate Python analytics as a back-end with the front-end
3473,5761,i encourage Boris to use the available tools and time to perfect these skills
3474,5762,He is so hardworking and always eager to learn
3475,5764,"Progressive in the area of systems development, irrespective of the laptop challenge."
3476,5765,He has perfected cisco IOS commands
3477,5766,encouraged to take as much notes and possible and to ask as many questions as possible to any colleague for her understanding of ICT business processes and operations
3478,5767,"Reported on time.
Configured the Network very well using Cisco Packet Tracer."
3479,5768,this was an introductory week for the interns to understand how NITA works
3480,5769,I encourage him to get used to the new schedule since internship is only for 6 weeks.
3481,5770,"Time keeper
Good at team work"
3482,5775,"Good at practical demonstrations
Very disciplined
Time keeper"
3483,5776,According to what am seeing we  a half way of the progress because the supermarket was new and the person responsible for database and networking was only one but when he got BESIGYE RONALD they sat down they shared knowledge and davis to him some statistics such as cable testing and connecting servers to other client computers he learnt it very well because he is not a bad person he is calm and well behaved
3484,5777,"the intern was introduced to service management principles such as service requests, incident management, IT change management etc"
3485,5778,"introduced to practical ways of  service level management regarding IT service requests such as IAAS,BAAS"
3487,5782,He has managed to complete the exploratory data analysis and data visualization exercises with pandas.
3488,5783,"He has mastered basic configuration of mikrotik routers.
He understands Vlans and how to apply it in a network setting 
Needs to research more on voice communication protocals."
3489,5784,Great progress
3490,5785,It was progressive since she was able to complete all the tasks at hand.
3491,5786,He is willing to learn and discover new ideas and technology
3492,5787,Keep it Up
3493,5788,"Although the time factor is challenging, She has tried to dedicate time to learning and accomplishing all her tasks as assigned by the training officer"
3494,5789,She is getting more technical and learning new topics. she is a hard worker
3495,5790,Sarah has exhibited a high level of commitment in the way she executes her assigned activities. Technically she is easy to teach and guide through several I.T activities
3496,5797,He has perfected Cisco IOS commands. He can now configure layer 2 and 3 devices with ease.
3497,5798,Good knowledge of some basic SQL querying. Finances are a bit of a problem for him. sometimes he is not able to work.
3498,5799,She has completed the python starter course and exploratory data analysis with pandas
3499,5800,The data visualization tasks this week have been successfully implemented and I am satisfied with the progress made so far.
3500,5801,Rebecca has progressed in her understanding of pandas through the data analysis tasks that she has accomplished this week
3501,5802,"Completed:

General IT support knowledge (Troubleshooting of IT related problems such as network failure, computer malfunction, slowness of the computer, etc)
Operating System installation specifically windows 10 pro on computers
Creation of different accounts on a windows computer and how to change the account type
Setting up Account passwords
Installation of different softwares (Microsoft office, firefox, adobe, etc....)"
3502,5804,"Embraced application support, to offer technical support to URA clients which is very important in post system implementation."
3503,5806,worked with the DC team to practically avail DC resources to other entities.
3504,5807,worked with the service desk team to understand how the operationized systems are managed
3505,5809,He has completed the python exercise which shows that he is ready to take on more specific tasks like data analysis. I have given him a starter assignment for pandas to learn exploratory data analysis.
3506,5811,The pandas exercises have been completed.
3507,5812,Ibrahim is a good listener and he has courage to learn and deliver good work.
3508,5813,"Time management is good, He posses the ability work under pressure and meet deadlines, Committed and loves team work."
3509,5814,Absolutely awesome. Keep it up.
3510,5815,"Keep it up, Natosha. You will manage"
3511,5816,Great improvement
3512,5817,Keep it up Vanessa
3513,5821,Noted as required.
3514,5825,"The website under developed was structured (html) following right Gandapps standards.
Akora Solomon quite coped up very well with the team that was guiding him to ensure that the site development is up held."
3515,5826,good on working with cpanels
3517,5832,"Very observant during training, Participate well and help colleagues, submits task on time"
3518,5837,We have sent Allan to field and he has returned great results. We are proud of him.
3519,5839,Edrick has in the past two weeks moved from zero in using code igniter to a level we feel confident can support other team members. He is a well behaved person and very interested in learning new things
3520,5840,"We had a few spoiled computers to practice on but with a few problems we solved together, she got a foundation in Computer repair and maintenance, both hardware and Software which she can build on in the future."
3521,5841,Very Good User Interface
3522,5842,Joseph participated very well in the introductory sessions he had on virtualization
3523,5843,A good and hardworking student.
3525,5846,he performed well in backup
3526,5848,"He is an excellent person to work with. Has many good qualities such - he is result-oriented, keeps time, respects colleagues, good communication skills and is excelled with solving the problems assigned to him"
3527,5849,"An excellent team player. His love for embedded system is amazing. Wilberforce is a reliable person and has taken on the role of leading his other interns. Moreover, he goes beyond his assigned duties and assists in maintaining the acquired equipment. In the little time Wilberforce has been with us, he has had very many outputs, which i could equate to 2 years."
3528,5850,"Excellent person to work with. She is quick at learning new things. Moreover, she is a great team member. She keeps time and always finished work on time. She has extensive knowledge on IoT and most importantly, she loves what she does. She is the perfect person one should employ."
3529,5853,"-Attended meetings and participated in the training of R programming. 
 -Created graphs using R programming, data manipulation, and understanding of descriptive statistics.   
  -Presented a website project on mantle of hope and Atara Legacy Website.
-Attended the training on hosting a website on Cpanel and remote servers."
3530,5854,"Good integration with the team, shown by the participation in the #run4climate run organized by Tree Adoption Uganda, who had partnered with AirQo in May. Good progress in appreciating the mobile codebase, familiar with the deployment process for the mobile application"
3531,5855,"Completed:

General IT support continued
Remote connection using RDS, and Team viewer"
3532,5856,"-Presented a project on the website on Atara legacy.
-Attended meetings and participated in the training of R programming. 
 -Created graphs using R programming, data manipulation, and understanding of descriptive statistics.
-Attended the training on hosting a website on Cpanel and remote servers."
3533,5858,"Samuel is a collaborating person.
Despite the strict short deadlines given, he copies up with pressure.
He has always taken responsibilities for his mistakes and has ensured other teams deliver to the company's expected product quality."
3534,5859,"These modules being talked of are part of a mega AI driven school management software that we tasked our trainees to document.
The software is to automate school day to day activities."
3535,5860,"From this week, it was evident Gilbert had never interfaced with Server end programming. He had oracle knowledge but never applied it in real application development.
However, since we require results and perfect results with our softwares, the company is engaging him in more tasks to perfect such that he can be condfident in handling the company's code base."
3536,5861,"Took great initiative in content generation/design for the ""Know Your Air"" section of the mobile application. And is also very open to learning and receiving feedback. Generally good progress in getting integrated within the team."
3537,5862,"Overall performance for the past four weeks is rated 85%
This is due to her punctuality, daily attendance and proper communication."
3538,5863,Excellent team member. he keeps time and always works with colleagues to deliver the work on time.
3540,5866,"Completed:

General IT support continued
Remote connection using RDS, and Team viewer
Working on her internship project"
3541,5867,"They are supposed to have finished the SRS for the modules but however, team leaders havent commented on his compliance.
In this report, i expected to find something connected to SRS since all teams where assigned atleast a module and each person has a bite to take.
But well, am to find out on this specific report for this week ending."
3542,5868,"Well, week completed though he didnt attend his only one day physical session as part of the remote working arrangement."
3543,5869,Progressed in website work
3545,5871,He was engaging throughout his remote work engagements.
3549,5877,"Developing and upgrading the Boosted Smart School is actually what they have been doing all along. So that cannot be a task for the coming week.
Tasks are currently pending as reviews for their SRS are being made."
3550,5878,William managed to configure the back-end  for the project and also managed to add more buttons to simplify the data visualizations on the front-end.
3551,5879,Anna has perfected Cisco IOS commands. She can  now configure routers and switches without any challenge.
3552,5881,"I encourage Mercy to practice multitasking. In doing so, she will be able to handle internship and semester load with ease."
3554,5884,"-Started a new project on Soroti FC football club website.!
 -Created graphs using R programming, data manipulation, and understanding of descriptive statistics.
-Attended the training on hosting a website on Cpanel and remote servers."
3555,5885,David has quickly adapted to the new project  for internship which will involve preparing data for a topic classification task. He has finished most of the tasks with the primary task being data cleaning. For this he has explored a number of techniques like using an English dictionary to propose words for misspelled words in the dataset.
3556,5886,"-Attended the training on hosting a website on Cpanel and remote servers.   
-Presented a website project on mantle of hope and Atara Legacy Website.
-Attended meetings and participated in the training of R programming. 
 -Created graphs using R programming, data manipulation, and understanding of descriptive statistics."
3557,5887,I encourage Duncan to come to Stratcom for practice whenever he has some free time.
3558,5889,"-Presented a website project on mantle of hope.
-Attended meetings and participated in the training of R programming. 
 -Created graphs using R programming, data manipulation, and understanding of descriptive statistics.
-Attended the training on hosting a website on Cpanel and remote servers."
3559,5890,I encourage him to always contact the Lead Developer in case of any coding challenges.
3561,5892,Felix has managed to implement the front-end for the data manipulation system. Try your best to learn Django within the minimum possible time so as to start on the back-end of the data manipulation system.
3562,5894,Timothy has perfected Cisco IOS commands. He can now configure layer 2 and 3 devices with eases.
3563,5895,"Ibrahim has perfected Cisco IOS commands, and he can now configure layer 2 and 3 devices with ease. He is doing well."
3565,5898,He's free to contact the Lead Developer incase of any coding challenges. He can also make use of the internet to research about new concepts.
3566,5899,The intern demonstrated good programming skills
3568,5903,He fell sick but managed to complete some tasks. I encourage him to find some free and come to Stratcom to catch up with whatever he missed.
3569,5904,He has perfected Cisco IOS commands and he can now configure intermediary devices (routers and switches ) without any challenge(s)
3571,5907,Assignments completed in record time
3572,5908,"In order to perfect Cisco IOS commands, I encourage Allam to use simulation software like packet tracer or GN3"
3574,5910,Joshua has perfected Cisco IOS commands. He can now configure networking devices with ease.
3575,5911,"Being a hot season, he  should get used to Uganda weather"
3576,5912,I encourage Aaron to always contact the Lead Developer incase of any difficulty or coding challenge.
3577,5913,I encourage Nicholas to use free internet at Stratcom Cyber Cafe incase there are any tasks that are supposed to be completed online.
3578,5914,"She is compliant and misses no days at work.
Engaging and teachable"
3579,5915,"I encourage Davis to slow down the Trainer incase he is fast. Incase of any challenges, he is free to come to Stratcom for internship related help."
3580,5916,I still encourage Samuel to use simulation software to perfect IOS commands.
3581,5918,"He has proved being reliable to work with. 
He has greatly responded effectively when called for urgent activities throughout this week."
3582,5919,Student was excellent and hard working though he was frustrated with grasping a lot of content in a very short time
3584,5921,He beats deadline always
3585,5922,He has perfected Cisco IOS commands. He can configure routers and switches without any challenges.
3586,5923,The student has designed the platform database with professionalism. He is noticeably good at backend design and system requirements gathering.
3589,5926,"He has perfected Cisco IOS commands, and can now configure layer 2 and 3 devices with ease."
3590,5927,"In order to perfect Cisco IOS commands, I encourage Levin to use simulation software like packet tracer or GNS3  before interacting with physical devices."
3591,5928,I encourage Graceous to always contact the Lead Trainer incase of any difficulty.
3592,5929,Completed the certifications. Continued learning API concepts
3593,5930,Mark has successfully completed this week's tasks. I encourage him to get used to Ugandan weather.
3594,5931,"Despite a few challenges, Alex has managed to complete this week's tasks."
3595,5932,I encourage Moreen to always use her time at Stratcom to practice the newly acquired skills. She is also free to come to Stratcom any time and use the machines / equipment for practice purposes.
3597,5934,Jovan has completed this week's tasks. I encourage him to use simulation software to perfect Cisco IOS commands.
3598,5935,"With limited resources and equipment, he was still available and ready to learn."
3599,5938,did all the koans and passed them objective was to master the foundational concepts in the language which she seems to grasp
3600,5941,I still encourage Samuel to contact the Lead Trainer incase of new concepts that are a bit difficult
3601,5942,"Try switching to other database engines for but understanding how most database connectors work, so far so good."
3602,5945,"-Started a new project on Soroti FC football club website.!
 -Created graphs using R programming, data manipulation, and understanding of descriptive statistics.
-Attended the training on hosting a website on Cpanel and remote servers."
3603,5946,"Overall performance rating for the first 4 weeks of work with us is 80%.
Hope it proves in the remaining time of work."
3604,5949,"-Attended the software development training on adita Project.   
-Attended meetings and participated in the training of R programming. 
 -Created graphs using R programming, data manipulation, and understanding of descriptive statistics.   
  -Presented a website project on mantle of hope and Atara Legacy Website.
-Attended the training on hosting a website on Cpanel and remote servers."
3605,5950,"I encourage Alvin to practice multitasking. By doing so, he will be able to handle the semester load at campus and internship at Stratcom with ease."
3606,5952,"Time management is excellent, His general application of knowledge to address problems is excellent, He is a good listener and fast learner"
3607,5953,"-Attended the discussion on adita Project.   
-Attended meetings and participated in the training of R programming. 
 -Created graphs using R programming, data manipulation, and understanding of descriptive statistics.   
  -Presented a website project on mantle of hope and Atara Legacy Website.
-Attended the training on hosting a website on Cpanel and remote servers."
3609,5955,Great teamwork on the UIDs which have been refined from last week. Keep up the good work and keep putting more effort into the design improvements.
3610,5956,"He has perfected Cisco IOS commands, and he can now configure routers and switches without any challenges."
3611,5957,He has perfected Cisco IOS commands and he can now configure routers and switches without any  challenges.
3612,5958,He should always contact the Lead Developer incase of any coding challenges.
3613,5959,I encourage Rymon to plan his movements a bit early so that he doesn't miss any practical sessions.
3614,5960,He's free to contact the Lead Developer incase of any coding challenges.
3616,5964,Samson is willing to learn and add on his skills. He has expressed interest in data science through doing self tests on different datasets. We look forward to working with him on our Data manipulation system.
3617,5965,Shadia should always slow down the Lead Developer incase he is a bit fast. She should also contact him in person incase some new concepts are a bit difficult.
3618,5966,Francis is an engaging person
3619,5967,The student completed the abovementioned tasks satisfactorily.
3620,5969,"Completed:

General IT support continued
Remote connection using RDS, and Team viewer"
3621,5971,"Joan has perfected Cisco IOS commands. She can now configure layer 2, and 3 devices with ease."
3622,5972,"-Attended the discussion on adita Project.   
-Attended meetings and participated in the training of R programming. 
 -Created graphs using R programming, data manipulation, and understanding of descriptive statistics.   
  -Presented a website project on mantle of hope and Atara Legacy Website.
-Attended the training on hosting a website on Cpanel and remote servers."
3623,5973,"Azah has perfected Cisco IOS commands, and can now configure layer 2 & 3 devices with ease."
3624,5974,able to use different sites to host websites
3625,5976,"Despite on minor challenge, Bhan has successfully completed this week's tasks. He has also perfected CIsco IOS commands."
3627,5979,I encourage Desire to use the limited time available to complete all weekly tasks.
3628,5980,"Great work Emmanuel, continue practicing to get the best skills in Data Science."
3629,5981,"She is complaint and fast at meeting deadlines.
She has written her reports and delivered them in time.
She is trainable and self motivated."
3631,5983,"He has perfected Cisco IOS commands, and he can now configure intermediary devices (routers and switches) with ease."
3633,5985,"The main task for building a CNN for bean image classification has been accomplished and this is a milestone as he managed to successfully develop his first well performing CNN. He has also undertaken reading tasks for understanding the layers and composition of a neural network and we also had a lesson for the same. To accomplish the CNN, he managed to review the AlexNet architecture which was used as a guide to build his own classifier."
3634,5986,better with website designing
3635,5987,I encourage Precious to always contact the Lead Developer incase of any difficulty / coding challenges
3637,5989,"Whenever Joshua is free, he can come to Stratcom and try to catch up with whatever he's missed."
3638,5990,"-Attended the discussion on adita Project.  
-Set up Adita documentation. 
-Deployed the adita project on the local server.
-Participated in the web development of Soroti FC club website using Laravel.
-Attended meetings and participated in the training of R programming. 
 -Created graphs using R programming, data manipulation, and understanding of descriptive statistics.   
  -Presented a website project on mantle of hope and Atara Legacy Website.
-Attended the training on hosting a website on Cpanel and remote servers."
3639,5991,"Yes, Evans was guided by our technician  on some computer repairs"
3640,5992,Edgar has successfully completed this week's tasks. I still encourage him to plan his movements a bit early so that he can spend less on transport.
3641,5993,"Learning sessions were attended well, and tasks given were executed on time. Racheal proved exemplary leadership in learning and performance. Good Job!"
