id,comment_id,Comment
2340,3971,"Emmanuel learnt a lot in using Access database tools such reports, queries , forms and relationship. He is a good listener and did his tasks in time. He also makes research in some complicated tasks and comes out with the solutions in time."
2341,3974,He listens well and does as told in an excellent manner. He's kept that up for all of his time with us.
2342,3976,This was done though with difficulty
2344,3978,"Robinson has successfully completed this week's tasks. In addition, he has perfected all cisco IOS commands needed to operate or configure intermediary devices (routers and switches)."
2345,3979,Joshua successfully completed this week's tasks. I encourage him to get used to Linux since it's a very good operating system in terms of security.
2349,3984,"I encourage Francis to use the available devices (routers, switches,wireless routers, cables....etc) for practice."
2350,3985,Joan has perfected all IOS commands needed to operate a cisco networking device (layer 2 and 3). She can also install and troubleshoot software related issues on end devices.
2353,3988,done
2354,3989,Herbert has worked hand in hand with colleagues to complete the tasks assigned to them and has attended all scheduled meetings and programs. He has been a great team player and has performed as expected of him so far.
2355,3990,Well done
2357,3992,Mr Lutalo is very self motivated. He completed all this week's tasks on time and excellently.
2358,3993,This week's activities were aimed at challenging the intern's problem solving capabilities. Mr Lutalo proved his ability to troubleshoot all kinds of network set-ups and configurations with ease.
2359,3994,Mr Lutalo is very hardworking and academic. He tackles research topics with enthusiasm and presents the findings in a highly professional way.
2360,3998,"In addition to networking skills, Eve has acquired practical skills in installing Operating systems and application software on end devices."
2361,4001,Quite many tasks were assigned but I am impressed with his delivery.
2362,4002,All tasks have been met a successful week.
2363,4003,"He needs to delve deeper into the documentation, other than that a successful week, all tasks met."
2364,4019,"Good work done. Student needs to acqure a better laptop for a smoother learning experience.
Practice all the tasks by developing different real life solutions."
2365,4020,Amazing amount of research and implemetation. The enthusiasm shown was also great.
2366,4021,Good progress. There has also been a great amount of collaboration with the team member in charge of this Named Entity Recognition project
2367,4022,Great work and great initiative
2368,4023,The tasks have been well done and communication has been good
2369,4024,The student has been helpful and able to learn new ideas and skills in the week's activities like software installation & Upgrade on computers and  giving support to staff.
2370,4025,"1. The student is willing to Learn, He does  Tasks allocated to him in time.

2.  He is a Quick Learner. hopefully he will benefit alot from the field training."
2372,4028,This Intern did really well on the virtual internship with BCG.
2373,4030,Progress has been  cited
2374,4031,Progressed in coding.
2375,4033,Rosemary is now well acquainted with booting computers to my satisfaction
2376,4034,Rosemary learnt and is now more knowledgeable about computer troubleshooting to my satisfaction.  She is very critical and this will make her a good technician in future.
2378,4036,"Errors  led him to doing more research ,which was a point to test his resilience in systems development."
2379,4037,"Emmanuel was good in doing the tasks online. Though he was a little bit disturbed by his exams, he managed to finish all the tasks he was assigned. He learnt how to connect two computers remotely which e said will help him at school with his fellow students"
2380,4038,"Was able to accomplish the tasks at hand ,hence progressive after recovering her work too."
2381,4039,Jovia can now fix common PC issues with ease.
2382,4040,successfully did the system test as they were proceeding with the tasks at hand.
2383,4041,"With trouble shooting and repair basics. Display, booting and powering issues He has solutions since integration of the parts became known after disassembling laptops."
2387,4045,Patricio is a promising Linux guru. I encourage him to switch from windows to linux
2388,4046,All tasks assigned for the week were completed successfully. Nearby road under construction which calls for the noise within the  work environment.
2391,4050,"The student was actively involved in creation of farmers panel ,dashboard and expenses module of the farmers information system assigned to him"
2392,4051,done
2393,4052,Well done and great improvement
2395,4055,All tasks assigned got completed in time with 100% response rate.
2396,4056,"Glad to have him on board, great work ethic displayed."
2398,4061,"We were very impressed with Okello�s work ethic, enthusiasm, and drive."
2399,4062,"He lucked attention to detail, thus making some mistakes in the system gathering process"
2400,4063,"Implementing some features frequently made him impatient when things weren't functioning as expected,Though he managed to use his problem solving skills to provide simple solutions"
2401,4064,Okello was very supportive to his workmates thus resolving the issue of vue page rendering
2402,4065,"Okello was very passionate and wants to learn and improve. He needs to work
on managing his time wisely."
2403,4066,"Okello is a smart young man. Seems to know what he wants. Has a plan, and
should be successful"
2404,4067,More practice using Virtual platforms will help you further.
2405,4070,"The progress on converting the pop up to a page is good.
Sharif is creative in terms of design and the I believe the page is going to well when completed.
I think we undermined the weight of the task to be completed withing a week. 
It turns out it will cover part of next week.
Overall, progress is good."
2407,4072,I encourage Shadrack to balance time between  school and practical sessions at Stratcom.
2409,4075,"Her R&D Skills affected the team, especially on security matters. Her effort is dully noted."
2410,4076,"One of our chief Testers, with attention to detail. She made good application tests that added value to the Mobile Application in general."
2411,4077,Approved
2412,4079,"The student was able to learn and help in Online Declaration process of Assets, wealth and Liabilities by Civil servants and political leaders"
2415,4086,"Juliet has shown a hunger for learning, a huge motivator factor in understanding the changing environment of Information Technology. She has been at the forefront, especially when a task is assigned to her. I will suggest more training on getting out of the skin (comfort zone). A prudent individual."
2416,4087,"week's activities were successfully executed with the internee . i.e giving support and training some of officers on basic software and hardware use. anti virus update and other system support to staff. 
The internee has developed confidence in handling and supporting staff and clients."
2417,4088,He is proactive and willing to do whatever needs to be done. Good job Duncan.
2419,4090,"He expressed his challenges concerning data collection during interviews due to network issues. That aside, He has gotten a good grasp of how the system here runs."
2420,4091,"The intern has been able to complete the weekly tasks, like supporting secretaries on appropriate software solutions to complete certain tasks and assessment of the daily network status."
2421,4092,It was good to have him deliver critical feedback concerning the structure of and mode of delivery concerning our Music lessons.
2422,4093,I received good feedback concerning the tasks above. Well done.
2423,4101,He is a serious committed student.
2424,4102,"Well done Duncan, positive feedback received concerning this week's tasks."
2425,4103,He has a good understanding of what He's doing. well done.
2426,4104,Mr. Ssebaggala's understanding of local laws is amazing. He is ready to move an extra mile when it comes to research and reading ahead. His presentation of research findings is precise and professional.
2427,4105,"The whole period Mr. Ssebaggala interned with us has been a curve of learning. He is remarkable and surely an ""A"" student with us this internship period"
2428,4106,Emmanuel did all his tasks and completed them in the 6 weeks of his internship. He is a brilliant student and added another one week because of the exams interruptions making it 7 weeks.
2432,4110,"Rosemary is now in position to troubleshoot, diagnose and also perform preventive and corrective maintenance of a computer to my satisfaction. She has been very eager to learn new things and also work on different computers during her internship."
2433,4111,He acquired more skills in networking an  area which was  his among his key areas of interest
2435,4122,She is a promising Networking guru.
2436,4123,He is able to lead a team of network technician to design a LAN  putting all in words and hands with all the factors remaining constant such as location and costs involved in allocated time with efficiency.
2437,4124,Joan is a promising networking professional. She has acquired hands-on skills to troubleshoot network connectivity issues.
2440,4128,"Herbert is a Good time manager, hardworking, social and has created a good rapport with the team in Gulu. This has helped him achieve quite a lot so far."
2441,4130,"More time needed for fibre installation but so far so good.
You are handling the training well enough. Keep it up"
2443,4132,....
2444,4133,Very dependable and always willing to go above and beyond expectations.
2445,4134,Continue researching about IPv6 addressing.
2446,4136,Exams
2447,4137,EXAMS
2451,4141,"Other than working on his tasks, I like that Sharif likes to contribute to discussions about making the system better."
2452,4142,Had to create more time to learn how to come up with better design  which he did and we had good work done by him.
2453,4143,focus was on exams
2454,4149,you are encouraged to continue practicing.
2455,4151,more practice needed
2457,4153,advanced in networking since it was also his area of focus.
2458,4154,"He was new to dynamic websites designing using content management systems, but appreciated the technology  and picked interest in this area too."
2460,4156,Focus was on systems design  and e looked at the UI design in preparation for the HTML design and analysis leading to a better solution under development.
2461,4157,Focus this week was more on testing the system.
2463,4159,This week was challenging as the student was about to take on her exams so attention was divided though she managed to finish my assignment
2464,4160,I took the student through the basics of IP address and it�s her further research that helped a lot in this chapter
2467,4163,Progressive in the different areas being handled.
2468,4181,Completed the study with no problem.
2469,4182,"Discussed service flows together, he has clear understanding"
2470,4183,He always knew when to ask questions and when to seek guidance this helped him not to do double work during review processes with the stalk holders
2471,4184,"Please also add the option to save pre-determined tags and also save the previously used tags in the database. Otherwise, great progress."
2472,4185,Great Work! I'm looking forward to seeing the system working with real radio data.
2473,4186,Multiword search working well. Tasks executed as requested. Great Work
2474,4187,"Innocent is a wonderful young man, who has a great deal of success ahead of
him. He has been  thoughtful and kind. He has a great deal of self discipline and
initiative despite the challenge he faced in displaying data to the views he was able to archive it, this makes him a good intern."
2476,4193,Very Fast learner and a good team player while he was able to come up with the flows of the product he was first introduced to which was the SMS product.
2477,4194,Well implemented and completed by Edgar.
2478,4195,Edgar can indeed manage a high pressure environment and ensures to meet his deadlines.
2488,4220,Stacey has started internship. She is passionate about coding and we are going to equip her with coding skills in the latest technologies.
2489,4221,"Went to the field. Got a chance to interact with the public, negotiate with them and turn them to clients.
She is a confident lady"
2490,4222,"Juliet has shown a hunger for learning, a huge motivator factor in understanding the changing environment of Information Technology. She has been at the forefront, especially when a task is assigned to her. I will suggest more training on getting out of the skin (comfort zone). A prudent individual."
2491,4225,"Networking both peer to peer and interconnection of laptops, desktops   and switches is a plug and play know due to good termination performance and configurations on WIFI  and two laptops home group."
2492,4228,Learnt new skills
2495,4234,The student has completed the installation and configuration of the Moodle system under my supervision.
2496,4235,"Nickson can now install tally software on the computers among the staff members, also can disassemble and assemble the computer."
2497,4236,"Nickson can configure and troubleshoot  a network connectivity using a modem, router and a switch."
2498,4237,Nickson used a straight through technique (RJ45 connector and CAT-6 cable) used in local area networks to connect a computer to a network hub such as a router.
2499,4238,"Nickson is able to use Distributor management system (DMS) both through back office and hand held device(phone). 
Nickson is able to install the npengine.apk on the phone for the sales team.
He can also solve the problems arising from the field.
He is able to analyse data using the system inventory Vs Physical Inventory
He can use point of sale machine/visa ."
2500,4239,Nickson can use Flitter wave to make money transaction.
2501,4240,"Nickson is able to design a website , upload it, buy domain name and design the network structure using Cisco Packet Tracer."
2502,4249,Well done Ivan.
2503,4250,Herbert and his team are working hard in preparation for the next workshop on excel and coding with python and they have had meetings in regard to this. All tasks were accomplished.
2504,4253,Make use of the video tutorials to help master virtualization.
2505,4254,you are encouraged to continue researching about windows virtualization and access lists.
2506,4257,"He tries his best to complete the task assigned to him despite the fact that he's been busy with school.
Only a few tasks are done but they're done well."
2510,4301,With this knowledge and skill in design and editing. He is a good marketer  in campaigning both local and international business  due to the art and science applied in the logos and banners designed. please it keep up .
2511,4302,Learnt Git
2513,4315,"All tasks assigned to Herbert have been completed, to the organizations expectations. Well done."
2516,4319,The student is committed to ensuring the activities assigned to him are completed and he performs independent research for solutions.
2517,4326,"More practice needed to solidify your Hands-On skills,
kindly use the Virtualization Technologies available to assist you with this"
2518,4327,the student showed that he had an understanding of web design and development. he is encouraged to continue researching about web design and development.
2519,4329,I am impressed by the web implementation of the dashboards and this is one of the milestones for the internship project
2520,4330,Initial implementation of data analysis code into the dashboards has been done and this is the final deliverable for this project from Nicholas. We shall continue to work on this after the internship to have fully developed dashboards
2521,4331,Keep on practicing.
2522,4332,"Sharif has managed to do some work around the design of the analytics page but part of it has not been completed due to the tightness of school.
We've discussed arrangements to find time and finish this up.
He's also open to continue contributing whenever he gets time away from school which I believe will be good experience for him as well as the company.

It has been a good and learning experience working with Sharif."
2523,4334,The Students were walked through policies and procedures. Mr Lutalo was still phenomenon at comprehending the facts.
2527,4339,Proggressive
2530,4342,commended for support provided
2531,4349,Herbert presented well during the excel workshop together with his team members. His active participation and contribution to the team efforts has been highly appreciated by his colleagues. Great work Herbert.
2534,4354,Showed passion for networking and was able to terminate his cable well.
2535,4355,"Due to the less time ,they had and him being a 3rd year student, we had to multi-task in order to finish in time."
2537,4357,He focused on the paper work design since didnt know well Html and CSS
2540,4362,The student has completed the theming of the Moodle system under my supervision. I happy to report to you that the student can now independently setup and customize the moodle system. Moodle is the system that is currently used by Makerere University for the University's eLearning.
2541,4369,"Jovia has started internship at Stratcom. Since she is passionate about networking, we are  going to equip her with hands-on skills in networking and systems administration."
2542,4370,"Jovia has successfully completed this week's tasks. She can now dismantle / assemble a PC, and perform basic configurations on layer 2 and 3 networking devices."
2543,4371,I encourage Jovia to use the available networking equipment at Stratcom for practice.
2545,4373,She can now set up a LAN with a number of PCs. I also encourage her to plan her movements a bit early to save on transport costs.
2547,4376,"Edwin is very pro-active, he managed to learn and execute all the tasks i assigned to him in one take."
2548,4378,keep researching and practicing.
2549,4379,Make use of video tutorials and nuggets to help you master NAT and other subject areas
2550,4385,The student has independently figured out what was blocking him completing the task. He has completed the task
2551,4393,Challenges noted and encouraged to service as many computers as possible
2552,4394,"Very responsive and excellent, the features added were implemented."
2553,4395,"Edgar has been a progressive student these past 2 months at the company, He has been very responsive to the above tasks and he has been able to complete them in the required time frames and deadlines expected. he is always eager to learn and always up to the task. I am delighted with the work he has done and hope to stay with him for the next phases of the recruitment."
2554,4397,Finished as assigned
2555,4398,"With this task, She learnt how to find solutions on her. There was creative thinking as skill."
2556,4399,"on this week, each team member took up duties and responsibilities assigned to them and performed well in that regard. yes, there were changes on the time difference in Canada and this delayed the start of our workshops  and as per the failure of the gather town as a tool for monitoring and smooth interaction between interns and students, interns resorted to uploading students assignments on a drive."
2557,4400,"Simon has successfully completed this week's tasks. For some reason, he switched from coding to netwoking and he's doing well."
2559,4402,"A successful week, everything was delivered on time."
2560,4403,More experience on the job will help him get comfortable working with third-party services and API's.
2561,4405,all tasks were performed to perfection
2562,4411,Stacey is doing well. She has completed this week's tasks without any challenge.
2563,4412,The tasks and activities were successfully completed with no further errors. The mentioned systems are working and in good condition.
2564,4415,"To avoid injuries and other minor issues, I encourage Simon to be careful when working with PCs and networking equipment"
2566,4417,"Apart from power black outs, Simon has successfully completed this week's tasks."
2567,4418,I encourage Simon to perfect linux because it's a very good operating system in terms of security.
2568,4419,"To avoid minor injuries, I encourage Simon to always be careful when dismantling desktops."
2569,4420,Simon has perfected Cisco IOS commands. He can now configure routing protocols on layer 3 devices with ease.
2570,4421,Do more research about linux systems.
2571,4423,Her learnability has been high when it came to understanding GIT and PHP skills
2572,4424,Matthew is advised to pay attention to details
2573,4425,"undoubtedly, all these tasks mentioned were to be done and was done perfectly with relevant efforts put in place by Herbert and team members. coding was our last workshop and I'm proud of the team for seeing this through despite the challenges that were uncontrollable on our side."
2574,4426,you are encouraged to read more about windows servers
2575,4427,you are encouraged to keep practicing and reading more.
2576,4429,Challenges noted and will be addressed
2577,4430,the report was reviewed and guidance was provided.
2578,4431,Clarissa has started internship and she is doing well. We look forward to equipping her with hands-on skills in Networking and Systems Administration
2579,4432,"Apart from one minor incident, Clarissa has successfully completed this week's tasks."
2580,4433,She come now interconnect and configure layer 2 & 3 devices with ease.
2584,4437,"Been punctual, on time and selfless when it came to finishing her tasks."
2585,4438,Support for the active directory cleanup project is commended
2586,4440,"Herbert learnt how to fully use the canva.com tools to start working on his workshop manuals. He has also collaborated with his colleagues to complete the activity reports, Bi-Weekly reports and the Final project reports. Once again thanks for the great work Herbert."
2587,4441,Herbert has successfully completed all the manuals for the workshops that he participated in. He has also completed his final internship report which was officially signed and stamped by me. All tasks that were assigned to him have been completed to our expectations. Herbert has been a wonderful intern and we appreciate his commitment to completing his internship and for being a good team member to his colleagues.
2589,4443,I encourage Kenneth to get used to debugging coding errors because it's part of coding.
2591,4445,Identified challenges will be addressed during Matthew's session with the system Administrator in charge of active directory
2592,4458,Commended for support during Preventive Maintenance
2594,4484,"He managed to always report on time, and get we taken through the entire company rules and regulations"
2595,4485,"This was done from Jinja at one of our techparks.
He performed really well on the server rack assembly."
2596,4488,"The jituganda.com website was already up and running, all we needed was the maintenance and its completion"
2597,4489,Nice work
2599,4491,"He has done great work at writing documentation and making diagrams.
Completed all tasks that have been assigned to him."
2600,4492,"Still punctual. He has a good project idea. He maintains demonstrating exceptional computer skills.
He is highly appreciated by his colleagues."
2601,4493,"The attendance for this week has been made online.
He has continued to maintain a good working relationship with team members he was assigned too. Asks to learn and has been attentive during all the training."
2602,4495,IT Help desk managed well.
2603,4496,all pending tasks were accomplished by Edwin
2604,4497,all tasks were perfectly done by edwin
2605,4498,all tasks executed to perfection
2606,4499,all tasks were done by Edwin without supervision
2607,4500,all tasks were were excepptionally done
2608,4501,all tasks well done
2609,4554,Malcolm has successfully finished the first week of internship. I encourage him to always contact the Trainer incase of any difficulty.
2611,4556,"Jeremiah has started internship. We are going to equip him with hands-on skills and practical competence in Networking, Coding, PC repair & software maintenance for the next 6 weeks."
2613,4564,Winnie has started internship and she is doing well. We are going to equip her with hands-on skills for the next 6 weeks.
2614,4567,Brian has started internship and he is doing well. We are going to equip him with hands-on skills for the next 6 weeks.
2615,4568,Richards has started internship and he is doing well. We are going to equip him with hands-on skills and practical competence for the next 6 weeks.
2617,4572,Desire has started internship and she is doing well. We are going to equip her with hands-on skills for the next 6 weeks.
2618,4573,"Despite a few challenges, especially transport costs, Keneth has managed to  complete the first week of internship. We wish him the very best."
2619,4574,Happy With The Progress but you need to improve problem solving skills and focus on thinking outside the box on  some solutions to simply  understand business logic better!!!! good Go Peter
2620,4575,Watson has started internship. We are going to equip him with hands-on skills and practical competence for the next 6 weeks.
2621,4577,Joanita has successfully finished the first week of internship. I encourage her to move with friends after training sessions.
2622,4578,Mark has started internship. We are going to equip him with hands-on skills and practical competence for the next 6 weeks.
2623,4580,"Despite a few challenges, Powell has managed to complete the first week of internship."
